"estado";"lei";"desc";"link"
"Bahia";"Decreto Nº 19567 de 23 de março de 2020";"Dispõe sobre as medidas temporárias complementares para enfrentamento da emergência de saúde pública de importância internacional decorrente do coronavírus, e dá outras providências.";"http://leisestaduais.com.br/ba/decreto-n-19567-2020-bahia-dispoe-sobre-as-medidas-temporarias-complementares-para-enfrentamento-da-emergencia-de-saude-publica-de-importancia-internacional-decorrente-do-coronavirus-e-da-outras-providencias"
"Ceará";"Decreto Nº 33524 de 23 de março de 2020";"ALTERA O DECRETO 33.509, DE 13 DE MARÇO DE 2020.";"http://leisestaduais.com.br/ce/decreto-n-33524-2020-ceara-altera-o-decreto-33-509-de-13-de-marco-de-2020"
"Paraná";"Decreto Nº 4320 de 23 de março de 2020";"Altera dispositivos do Decreto nº 4.312, de 20 de março de 2020 e do Decreto nº 4.230, de 16 de março de 2020.";"http://leisestaduais.com.br/pr/decreto-n-4320-2020-parana-altera-dispositivos-do-decreto-no-4-312-de-20-de-marco-de-2020-e-do-decreto-no-4-230-de-16-de-marco-de-2020"
"Rio de Janeiro";"Lei Ordinária Nº 8766 de 23 de março de 2020";"AUTORIZA O PODER EXECUTIVO A CONCEDER ISENÇÃO DO IMPOSTO SOBRE OPERAÇÕES RELATIVAS À CIRCULAÇÃO DE MERCADORIAS E SERVIÇOS - ICMS NAS CONTAS DE ENERGIA ELÉTRICA E DOS SERVIÇOS DE TELECOMUNICAÇÃO PELO PRAZO DE 180 DIAS, DOS CONSUMIDORES AFETADOS PELOS DESASTRES NATURAIS DECORRENTES DAS CHUVAS DOS MESES DE JANEIRO E FEVEREIRO DE 2020 E PELO CORONAVÍRUS, ENQUANTO PERDURAREM OS EFEITOS DO DECRETO Nº 46.973, DE 16 DE MARÇO DE 2020.";"http://leisestaduais.com.br/rj/lei-ordinaria-n-8766-2020-rio-de-janeiro-autoriza-o-poder-executivo-a-conceder-isencao-do-imposto-sobre-operacoes-relativas-a-circulacao-de-mercadorias-e-servicos-icms-nas-contas-de-energia-eletrica-e-dos-servicos-de-telecomunicacao-pelo-prazo-de-180-dias-dos-consumidores-afetados-pelos-desastres-naturais-decorrentes-das-chuvas-dos-meses-de-janeiro-e-fevereiro-de-2020-e-pelo-coronavirus-enquanto-perdurarem-os-efeitos-do-decreto-no-46-973-de-16-de-marco-de-2020"
"Piauí";"Decreto Nº 18902 de 23 de março de 2020";"Determina a suspensão das atividades comerciais e de prestação de serviços, em complemento ao Decreto nº 18.901, de 19 de março de 2020, que determina as medidas excepcionais que especifica, voltadas para o enfrentamento da grave crise de saúde pública decorrente do Covid-19, e dá outras providências.";"http://leisestaduais.com.br/pi/decreto-n-18902-2020-piaui-determina-a-suspensao-das-atividades-comerciais-e-de-prestacao-de-servicos-em-complemento-ao-decreto-no-18-901-de-19-de-marco-de-2020-que-determina-as-medidas-excepcionais-que-especifica-voltadas-para-o-enfrentamento-da-grave-crise-de-saude-publica-decorrente-do-covid-19-e-da-outras-providencias"
"Rio Grande do Sul";"Decreto Nº 55135 de 23 de março de 2020";"Altera o Decreto nº 55.128, de 19 de março de 2020, que declara situação de calamidade";"http://leisestaduais.com.br/rs/decreto-n-55135-2020-rio-grande-do-sul-altera-o-decreto-no-55-128-de-19-de-marco-de-2020-que-declara-situacao-de-calamidade"
"Rio de Janeiro";"Lei Ordinária Nº 8770 de 23 de março de 2020";"AUTORIZA O PODER EXECUTIVO A ADOTAR AS MEDIDAS QUE ESPECIFICA E DÁ OUTRAS PROVIDÊNCIAS.";"http://leisestaduais.com.br/rj/lei-ordinaria-n-8770-2020-rio-de-janeiro-autoriza-o-poder-executivo-a-adotar-as-medidas-que-especifica-e-da-outras-providencias"
"Amazonas";"Decreto Nº 42101 de 23 de março de 2020";"DISPÕE sobre medidas complementares temporárias, para enfrentamento da emergência de saúde pública de importância internacional, decorrente do novo coronavírus.";"http://leisestaduais.com.br/am/decreto-n-42101-2020-amazonas-dispoe-sobre-medidas-complementares-temporarias-para-enfrentamento-da-emergencia-de-saude-publica-de-importancia-internacional-decorrente-do-novo-coronavirus"
"Roraima";"Decreto Nº 28635 de 22 de março de 2020";"Declara estado de calamidade pública em todo o território do Estado de Roraima para fins de prevenção e de enfrentamento à epidemia causada pelo COVID-19 (Coronavírus), e dá outras providências.";"http://leisestaduais.com.br/rr/decreto-n-28635-2020-roraima-declara-estado-de-calamidade-publica-em-todo-o-territorio-do-estado-de-roraima-para-fins-de-prevencao-e-de-enfrentamento-a-epidemia-causada-pelo-covid-19-coronavirus-e-da-outras-providencias"
"Espírito Santo";"Decreto Nº 4607 de 22 de março de 2020";"Dispõe sobre a infringência as determinações constantes em Decretos e demais atos expedidos por autoridades estaduais que veiculam medidas para enfrentamento da emergência de saúde pública decorrente do novo coronavírus (COVID-19), altera o Decreto nº 4.605-R, de 20 de março de 2020, e dá outras providências.";"http://leisestaduais.com.br/es/decreto-n-4607-2020-espirito-santo-dispoe-sobre-a-infringencia-as-determinacoes-constantes-em-decretos-e-demais-atos-expedidos-por-autoridades-estaduais-que-veiculam-medidas-para-enfrentamento-da-emergencia-de-saude-publica-decorrente-do-novo-coronavirus-covid-19-altera-o-decreto-no-4-605-r-de-20-de-marco"
"Pernambuco";"Decreto Nº 48836 de 22 de março de 2020";"Altera o Decreto nº 48.834, de 20 de março de 2020, que define no âmbito socioeconômico medidas restritivas temporárias adicionais para enfrentamento da emergência de saúde pública de importância internacional decorrente do coronavírus.";"http://leisestaduais.com.br/pe/decreto-n-48836-2020-pernambuco-altera-o-decreto-no-48-834-de-20-de-marco-de-2020-que-define-no-ambito-socioeconomico-medidas-restritivas-temporarias-adicionais-para-enfrentamento-da-emergencia-de-saude-publica-de-importancia-internacional-decorrente-do-coronavirus"
"Paraná";"Decreto Nº 4318 de 22 de março de 2020";"Altera o art. 2º do Decreto nº 4.317, de 21 de março de 2020.";"http://leisestaduais.com.br/pr/decreto-n-4318-2020-parana-altera-o-art-2o-do-decreto-no-4-317-de-21-de-marco-de-2020"
"Pernambuco";"Decreto Nº 48835 de 22 de março de 2020";"Define medidas temporárias adicionais para enfrentamento da emergência de saúde pública de importância internacional decorrente do coronavírus.";"http://leisestaduais.com.br/pe/decreto-n-48835-2020-pernambuco-define-medidas-temporarias-adicionais-para-enfrentamento-da-emergencia-de-saude-publica-de-importancia-internacional-decorrente-do-coronavirus"
"Bahia";"Decreto Nº 19555 de 22 de março de 2020";"Dispõe sobre as medidas temporárias complementares para enfrentamento da emergência de saúde pública de importância internacional decorrente do coronavírus, e dá outras providências.";"http://leisestaduais.com.br/ba/decreto-n-19555-2020-bahia-dispoe-sobre-as-medidas-temporarias-complementares-para-enfrentamento-da-emergencia-de-saude-publica-de-importancia-internacional-decorrente-do-coronavirus-e-da-outras-providencias"
"São Paulo";"Decreto Nº 64881 de 22 de março de 2020";"Decreta quarentena no Estado de São Paulo, no contexto da pandemia do COVID-19 (Novo Coronavírus), e dá providências complementares.";"http://leisestaduais.com.br/sp/decreto-n-64881-2020-sao-paulo-decreta-quarentena-no-estado-de-sao-paulo-no-contexto-da-pandemia-do-covid-19-novo-coronavirus-e-da-providencias-complementares"
"Amapá";"Decreto Nº 1415 de 22 de março de 2020";"Altera o Decreto Estadual nº 1.414 de 19 março de 2020, que dispõe sobre restrições de funcionamento para o fim de combater a disseminação do novo Coronavírus (Covid 19) no território do Estado do Amapá.";"http://leisestaduais.com.br/ap/decreto-n-1415-2020-amapa-altera-o-decreto-estadual-no-1-414-de-19-marco-de-2020-que-dispoe-sobre-restricoes-de-funcionamento-para-o-fim-de-combater-a-disseminacao-do-novo-coronavirus-covid-19-no-territorio-do-estado-do-amapa"
"Maranhão";"Decreto Nº 35678 de 22 de março de 2020";"Altera o Decreto nº 35.677, de 21 de março de 2020, que estabelece medidas de prevenção do contágio e de combate à propagação da transmissão da COVID-19, infecção humana causada pelo Coronavírus (SARS-CoV-2).";"http://leisestaduais.com.br/ma/decreto-n-35678-2020-maranhao-altera-o-decreto-no-35-677-de-21-de-marco-de-2020-que-estabelece-medidas-de-prevencao-do-contagio-e-de-combate-a-propagacao-da-transmissao-da-covid-19-infeccao-humana-causada-pelo-coronavirus-sars-cov-2"
"Bahia";"Decreto Nº 19554 de 21 de março de 2020";"Dispõe sobre as medidas temporárias complementares para enfrentamento da emergência de saúde pública de importância internacional decorrente do coronavírus, e dá outras providências.";"http://leisestaduais.com.br/ba/decreto-n-19554-2020-bahia-dispoe-sobre-as-medidas-temporarias-complementares-para-enfrentamento-da-emergencia-de-saude-publica-de-importancia-internacional-decorrente-do-coronavirus-e-da-outras-providencias"
"Amazonas";"Decreto Nº 42099 de 21 de março de 2020";"DISPÕE sobre medidas complementares temporárias, para enfrentamento da emergência de saúde pública de importância internacional, decorrente do novo coronavírus.";"http://leisestaduais.com.br/am/decreto-n-42099-2020-amazonas-dispoe-sobre-medidas-complementares-temporarias-para-enfrentamento-da-emergencia-de-saude-publica-de-importancia-internacional-decorrente-do-novo-coronavirus"
"Ceará";"Decreto Nº 33521 de 21 de março de 2020";"ALTERA O DECRETO Nº 33.519, DE 19 DE MARÇO DE 2020, QUE PREVÊ MEDIDAS PARA ENFRENTAMENTO DA INFECÇÃO HUMANA PELO NOVO CORONAVÍRUS, E DÁ OUTRAS PROVIDÊNCIAS.";"http://leisestaduais.com.br/ce/decreto-n-33521-2020-ceara-altera-o-decreto-no-33-519-de-19-de-marco-de-2020-que-preve-medidas-para-enfrentamento-da-infeccao-humana-pelo-novo-coronavirus-e-da-outras-providencias"
"Paraná";"Decreto Nº 4316 de 21 de março de 2020";"Dispõe sobre a manutenção do abastecimento e distribuição de produtos necessários e essenciais, inclusive merendas escolares, na rede pública de ensino em decorrência da pandemia da COVID-19, e adota outras providências.";"http://leisestaduais.com.br/pr/decreto-n-4316-2020-parana-dispoe-sobre-a-manutencao-do-abastecimento-e-distribuicao-de-produtos-necessarios-e-essenciais-inclusive-merendas-escolares-na-rede-publica-de-ensino-em-decorrencia-da-pandemia-da-covid-19-e-adota-outras-providencias"
"Paraná";"Decreto Nº 4310 de 21 de março de 2020";"Altera o Decreto nº 4.230, de 16 de março de 2020, que dispõe sobre as medidas para enfrentamento da emergência de saúde pública de importância internacional decorrente do Coronavírus - COVID-19.";"http://leisestaduais.com.br/pr/decreto-n-4310-2020-parana-altera-o-decreto-no-4-230-de-16-de-marco-de-2020-que-dispoe-sobre-as-medidas-para-enfrentamento-da-emergencia-de-saude-publica-de-importancia-internacional-decorrente-do-coronavirus-covid-19"
"Paraná";"Decreto Nº 4315 de 21 de março de 2020";"Dispõe sobre a dispensa de licitação e procedimento para a modalidade pregão para o enfrentamento da emergência de saúde pública de importância internacional decorrente do coronavírus responsável pelo surto de 2019 e adota outras providências.";"http://leisestaduais.com.br/pr/decreto-n-4315-2020-parana-dispoe-sobre-a-dispensa-de-licitacao-e-procedimento-para-a-modalidade-pregao-para-o-enfrentamento-da-emergencia-de-saude-publica-de-importancia-internacional-decorrente-do-coronavirus-responsavel-pelo-surto-de-2019-e-adota-outras-providencias"
"Paraíba";"Decreto Nº 40136 de 21 de março de 2020";"Dispõe sobre a adoção, no âmbito da Administração Pública direta e indireta, de regime de trabalho remoto, em razão das medidas temporárias e emergenciais de prevenção de contágio pelo COVID-19 (Novo Coronavírus).";"http://leisestaduais.com.br/pb/decreto-n-40136-2020-paraiba-dispoe-sobre-a-adocao-no-ambito-da-administracao-publica-direta-e-indireta-de-regime-de-trabalho-remoto-em-razao-das-medidas-temporarias-e-emergenciais-de-prevencao-de-contagio-pelo-covid-19-novo-coronavirus"
"Paraná";"Decreto Nº 4317 de 21 de março de 2020";"Dispõe sobre as medidas para a iniciativa privada acerca do enfrentamento da emergência de saúde pública de importância decorrente da COVID-19.";"http://leisestaduais.com.br/pr/decreto-n-4317-2020-parana-dispoe-sobre-as-medidas-para-a-iniciativa-privada-acerca-do-enfrentamento-da-emergencia-de-saude-publica-de-importancia-decorrente-da-covid-19"
"Tocantins";"Decreto Nº 6072 de 21 de março de 2020";"Declara estado de calamidade pública em todo o território do Estado do Tocantins afetado pela COVID-19 (novo Coronavírus) - Codificação Brasileira de Desastre 1.5.1.1.0, e adota outras providências.";"http://leisestaduais.com.br/to/decreto-n-6072-2020-tocantins-declara-estado-de-calamidade-publica-em-todo-o-territorio-do-estado-do-tocantins-afetado-pela-covid-19-novo-coronavirus-codificacao-brasileira-de-desastre-1-5-1-1-0-e-adota-outras-providencias"
"Maranhão";"Decreto Nº 35677 de 21 de março de 2020";"Estabelece medidas de prevenção do contágio e de combate à propagação da transmissão da COVID-19, infecção humana causada pelo Coronavírus (SARS-CoV-2).";"http://leisestaduais.com.br/ma/decreto-n-35677-2020-maranhao-estabelece-medidas-de-prevencao-do-contagio-e-de-combate-a-propagacao-da-transmissao-da-covid-19-infeccao-humana-causada-pelo-coronavirus-sars-cov-2"
"Rio Grande do Sul";"Decreto Nº 55130 de 20 de março de 2020";"Altera o Decreto nº 55.128, de 19 de março de 2020, que declara situação de calamidade";"http://leisestaduais.com.br/rs/decreto-n-55130-2020-rio-grande-do-sul-altera-o-decreto-no-55-128-de-19-de-marco-de-2020-que-declara-situacao-de-calamidade"
"Distrito Federal";"Decreto Nº 40547 de 20 de março de 2020";"Promove a destinação das instalações e equipamentos do Centro Médico de Polícia Militar do Distrito Federal para o atendimento geral à população durante o período de combate à pandemia causada pelo vírus SARS-CoV-2 (COVID-19), determina a prestação isonômica de serviços médicos na citada unidade, transfere a administração da citada unidade de saúde para a Secretaria de Saúde e requisita os serviços da força de trabalho do IGES, e dá outras providências.";"http://leisestaduais.com.br/df/decreto-n-40547-2020-distrito-federal-promove-a-destinacao-das-instalacoes-e-equipamentos-do-centro-medico-de-policia-militar-do-distrito-federal-para-o-atendimento-geral-a-populacao-durante-o-periodo-de-combate-a-pandemia-causada-pelo-virus-sars-cov-2-covid-19-determina-a-prestacao-isonomica-de-servicos-medicos-na-citada-unidade-transfere-a-administracao-da-citada-unidade-de-saude-para-a-secretaria-de-saude-e-requisita-os-servicos-da-forca-de-trabalho-do-iges-e-da-outras-providencias"
"Acre";"Decreto Nº 5496 de 20 de março de 2020";"Estabelece novas medidas para enfrentamento da emergência de saúde pública decorrente da doença COVID-19, causada pelo coronavírus SARS-CoV-2.";"http://leisestaduais.com.br/ac/decreto-n-5496-2020-acre-estabelece-novas-medidas-para-enfrentamento-da-emergencia-de-saude-publica-decorrente-da-doenca-covid-19-causada-pelo-coronavirus-sars-cov-2"
"Pará";"Lei Ordinária Nº 9032 de 20 de março de 2020";"Fica criado o Fundo Esperança, destinado a dar apoio emergencial aos pequenos e microempreendedores, no âmbito do Estado do Pará.";"http://leisestaduais.com.br/pa/lei-ordinaria-n-9032-2020-para-fica-criado-o-fundo-esperanca-destinado-a-dar-apoio-emergencial-aos-pequenos-e-microempreendedores-no-ambito-do-estado-do-para"
"Pernambuco";"Decreto Nº 48834 de 20 de março de 2020";"Define no âmbito socioeconômico medidas restritivas temporárias adicionais para enfrentamento da emergência de saúde pública de importância internacional decorrente do coronavírus.";"http://leisestaduais.com.br/pe/decreto-n-48834-2020-pernambuco-define-no-ambito-socioeconomico-medidas-restritivas-temporarias-adicionais-para-enfrentamento-da-emergencia-de-saude-publica-de-importancia-internacional-decorrente-do-coronavirus"
"Amazonas";"Decreto Nº 42098 de 20 de março de 2020";"DISPÕE sobre medidas complementares temporárias, para enfrentamento da emergência de saúde pública de importância internacional, decorrente do novo coronavírus.";"http://leisestaduais.com.br/am/decreto-n-42098-2020-amazonas-dispoe-sobre-medidas-complementares-temporarias-para-enfrentamento-da-emergencia-de-saude-publica-de-importancia-internacional-decorrente-do-novo-coronavirus"
"São Paulo";"Decreto Nº 64879 de 20 de março de 2020";"Reconhece o estado de calamidade pública, decorrente da pandemia do COVID-19, que atinge o Estado de São Paulo, e dá providências correlatas.";"http://leisestaduais.com.br/sp/decreto-n-64879-2020-sao-paulo-reconhece-o-estado-de-calamidade-publica-decorrente-da-pandemia-do-covid-19-que-atinge-o-estado-de-sao-paulo-e-da-providencias-correlatas"
"Paraná";"Decreto Nº 4311 de 20 de março de 2020";"Altera o Decreto nº 4.230, de 16 de março de 2020, que dispõe sobre as medidas para enfrentamento da emergência de saúde pública de importância internacional decorrente do Coronavírus - COVID-19.";"http://leisestaduais.com.br/pr/decreto-n-4311-2020-parana-altera-o-decreto-no-4-230-de-16-de-marco-de-2020-que-dispoe-sobre-as-medidas-para-enfrentamento-da-emergencia-de-saude-publica-de-importancia-internacional-decorrente-do-coronavirus-covid-19"
"Paraíba";"Decreto Nº 40134 de 20 de março de 2020";"Declara estado de calamidade pública, para os fi ns do art. 65 da Lei Complementar nº 101, de 04 de maio de 2000, em razão da grave crise de saúde pública decorrente da pandemia do Coronavírus";"http://leisestaduais.com.br/pb/decreto-n-40134-2020-paraiba-declara-estado-de-calamidade-publica-para-os-fi-ns-do-art-65-da-lei-complementar-no-101-de-04-de-maio-de-2000-em-razao-da-grave-crise-de-saude-publica-decorrente-da-pandemia-do-coronavirus"
"Paraíba";"Decreto Nº 40135 de 20 de março de 2020";"Dispõe sobre a adoção, no âmbito da Administração Pública direta e indireta, de medidas temporárias e emergenciais de prevenção de contágio pelo COVID-19 (Novo Coronavírus), bem como sobre recomendações aos municípios e ao setor privado estadual.";"http://leisestaduais.com.br/pb/decreto-n-40135-2020-paraiba-dispoe-sobre-a-adocao-no-ambito-da-administracao-publica-direta-e-indireta-de-medidas-temporarias-e-emergenciais-de-prevencao-de-contagio-pelo-covid-19-novo-coronavirus-bem-como-sobre-recomendacoes-aos-municipios-e-ao-setor-privado-estadual"
"Rio de Janeiro";"Decreto Nº 46984 de 20 de março de 2020";"DECRETA ESTADO DE CALAMIDADE PÚBLICA NO ESTADO DO RIO DE JANEIRO EM DECORRÊNCIA DO NOVO CORONAVÍRUS (COVID-19), E DÁ OUTRAS PROVIDÊNCIAS.";"http://leisestaduais.com.br/rj/decreto-n-46984-2020-rio-de-janeiro-decreta-estado-de-calamidade-publica-no-estado-do-rio-de-janeiro-em-decorrencia-do-novo-coronavirus-covid-19-e-da-outras-providencias"
"Distrito Federal";"Decreto Nº 40546 de 20 de março de 2020";"Dispõe sobre o teletrabalho, em caráter excepcional e provisório, para os órgãos da administração pública direta, indireta, autárquica e fundacional do Distrito Federal, a partir de 23 de março de 2020, como medida necessária à continuidade do funcionamento da administração pública distrital, em virtude da atual situação de emergência em saúde pública e pandemia declarada pela Organização Mundial de Saúde (OMS), em decorrência do coronavírus (COVID-19), e dá outras providências.";"http://leisestaduais.com.br/df/decreto-n-40546-2020-distrito-federal-dispoe-sobre-o-teletrabalho-em-carater-excepcional-e-provisorio-para-os-orgaos-da-administracao-publica-direta-indireta-autarquica-e-fundacional-do-distrito-federal-a-partir-de-23-de-marco-de-2020-como-medida-necessaria-a-continuidade-do-funcionamento-da-administracao-publica-distrital-em-virtude-da-atual-situacao-de-emergencia-em-saude-publica-e-pandemia-declarada-pela-organizacao-mundial-de-saude-oms-em-decorrencia-do-coronavirus-covid-19-e-da-outras-providencias"
"Rondônia";"Decreto Nº 24887 de 20 de março de 2020";"Declara Estado de Calamidade Pública em todo o território do Estado de Rondônia, para fins de prevenção e enfrentamento à pandemia causada pelo novo Coronavírus - COVID-19 e revoga o Decreto nº 24.871, de 16 de março de 2020.";"http://leisestaduais.com.br/ro/decreto-n-24887-2020-rondonia-declara-estado-de-calamidade-publica-em-todo-o-territorio-do-estado-de-rondonia-para-fins-de-prevencao-e-enfrentamento-a-pandemia-causada-pelo-novo-coronavirus-covid-19-e-revoga-o-decreto-no-24-871-de-16-de-marco-de-2020"
"Bahia";"Decreto Nº 19553 de 20 de março de 2020";"Dispõe sobre as medidas temporárias complementares para enfrentamento da emergência de saúde pública de importância internacional decorrente do coronavírus e dá outras providências.";"http://leisestaduais.com.br/ba/decreto-n-19553-2020-bahia-dispoe-sobre-as-medidas-temporarias-complementares-para-enfrentamento-da-emergencia-de-saude-publica-de-importancia-internacional-decorrente-do-coronavirus-e-da-outras-providencias"
"Goiás";"Decreto Nº 9638 de 20 de março de 2020";"Altera o Decreto nº 9.633, de 13 de março de 2020, e dá outras providências.";"http://leisestaduais.com.br/go/decreto-n-9638-2020-goias-altera-o-decreto-no-9-633-de-13-de-marco-de-2020-e-da-outras-providencias"
"Alagoas";"Decreto Nº 69541 de 20 de março de 2020";"DECLARA A SITUAÇÃO DE EMERGÊNCIA NO ESTADO DE ALAGOAS E INTENSIFICA AS MEDIDAS PARA ENFRENTAMENTO DA EMERGÊNCIA DE SAÚDE PÚBLICA DE IMPORTÂNCIA INTERNACIONAL DECORRENTE DO COVID - 19 (CORONAVÍRUS) NO ÂMBITO DO ESTADO DE ALAGOAS, E DÁ OUTRAS PROVIDÊNCIAS.";"http://leisestaduais.com.br/al/decreto-n-69541-2020-alagoas-declara-a-situacao-de-emergencia-no-estado-de-alagoas-e-intensifica-as-medidas-para-enfrentamento-da-emergencia-de-saude-publica-de-importancia-internacional-decorrente-do-covid-19-coronavirus-no-ambito-do-estado-de-alagoas-e-da-outras-providencias"
"Mato Grosso do Sul";"Decreto Nº 15397 de 20 de março de 2020";"Dispõe sobre a suspensão dos prazos administrativos, no âmbito da Administração Pública Direta e Indireta do Poder Executivo do Estado de Mato Grosso do Sul, nos termos que especifica.";"http://leisestaduais.com.br/ms/decreto-n-15397-2020-mato-grosso-do-sul-dispoe-sobre-a-suspensao-dos-prazos-administrativos-no-ambito-da-administracao-publica-direta-e-indireta-do-poder-executivo-do-estado-de-mato-grosso-do-sul-nos-termos-que-especifica"
"Minas Gerais";"Decreto Nº 47891 de 20 de março de 2020";"Reconhece o estado de calamidade pública decorrente da pandemia causada pelo agente Coronavírus (COVID-19).";"http://leisestaduais.com.br/mg/decreto-n-47891-2020-minas-gerais-reconhece-o-estado-de-calamidade-publica-decorrente-da-pandemia-causada-pelo-agente-coronavirus-covid-19"
"Mato Grosso";"Decreto Nº 419 de 20 de março de 2020";"Dispõe sobre medidas temporárias restritivas às atividades privadas para prevenção dos riscos de disseminação do Coronavírus (COVID-19).";"http://leisestaduais.com.br/mt/decreto-n-419-2020-mato-grosso-dispoe-sobre-medidas-temporarias-restritivas-as-atividades-privadas-para-prevencao-dos-riscos-de-disseminacao-do-coronavirus-covid-19"
"Santa Catarina";"Decreto Legislativo Nº 18332 de 20 de março de 2020";"Declara estado de calamidade pública em Santa Catarina, para fins do disposto no art. 65 da Lei Complementar nº 101, de 2000.";"http://leisestaduais.com.br/sc/decreto-legislativo-n-18332-2020-santa-catarina-declara-estado-de-calamidade-publica-em-santa-catarina-para-fins-do-disposto-no-art-65-da-lei-complementar-no-101-de-2000"
"São Paulo";"Decreto Nº 64880 de 20 de março de 2020";"Dispõe sobre a adoção, no âmbito das Secretarias da Saúde e da Segurança Pública, de medidas temporárias e emergenciais de prevenção de contágio pelo COVID-19 (Novo Coronavírus).";"http://leisestaduais.com.br/sp/decreto-n-64880-2020-sao-paulo-dispoe-sobre-a-adocao-no-ambito-das-secretarias-da-saude-e-da-seguranca-publica-de-medidas-temporarias-e-emergenciais-de-prevencao-de-contagio-pelo-covid-19-novo-coronavirus"
"Pernambuco";"Decreto Nº 48833 de 20 de março de 2020";"Declara situação anormal, caracterizada como ""Estado de Calamidade Pública"", no âmbito do Estado de Pernambuco, em virtude da emergência de saúde pública de importância internacional decorrente do coronavírus.";"http://leisestaduais.com.br/pe/decreto-n-48833-2020-pernambuco-declara-situacao-anormal-caracterizada-como-estado-de-calamidade-publica-no-ambito-do-estado-de-pernambuco-em-virtude-da-emergencia-de-saude-publica-de-importancia-internacional-decorrente-do-coronavirus"
"Acre";"Decreto Nº 5495 de 20 de março de 2020";"Estabelece as medidas de controle de despesas primárias correntes do Poder Executivo para o exercício de 2020, e dá outras providências.";"http://leisestaduais.com.br/ac/decreto-n-5495-2020-acre-estabelece-as-medidas-de-controle-de-despesas-primarias-correntes-do-poder-executivo-para-o-exercicio-de-2020-e-da-outras-providencias"
"Distrito Federal";"Decreto Nº 40548 de 20 de março de 2020";"Dispõe sobre a suspensão dos serviços de coleta seletiva, triagem de resíduos recicláveis e compostagem no âmbito do Distrito Federal.";"http://leisestaduais.com.br/df/decreto-n-40548-2020-distrito-federal-dispoe-sobre-a-suspensao-dos-servicos-de-coleta-seletiva-triagem-de-residuos-reciclaveis-e-compostagem-no-ambito-do-distrito-federal"
"Rio Grande do Sul";"Decreto Nº 55128 de 19 de março de 2020";"Declara estado de calamidade pública em todo o território do Estado do Rio Grande do Sul para fins de prevenção e de enfrentamento à epidemia causada pelo COVID-19 (novo Coronavírus), e dá outras providências.";"http://leisestaduais.com.br/rs/decreto-n-55128-2020-rio-grande-do-sul-declara-es-tado-de-calam-idade-publica-em-todo-o-territorio-do-es-tado-do-rio-grande-do-sul-para-fins-de-prevencao-e-de-enfrentam-ento-a-epidem-ia-caus-ada-pelo-covid-19-novo-coronavirus-e-da-outras-providencias"
