"estado";"lei";"desc";"link"
"Paraíba";"Decreto Nº 40170 de 3 de abril de 2020";"Dispõe sobre o diferimento do Imposto sobre Operações Relativas à Circulação de Mercadorias e sobre Prestações de Serviços de Transporte Interestadual e Intermunicipal e de Comunicação - ICMS - nas aquisições interestaduais de aparelhos, máquinas, equipamentos e instrumentos médico-hospitalares, nas condições que especifica, e dá outras providências.";"http://leisestaduais.com.br/pb/decreto-n-40170-2020-paraiba-dispoe-sobre-o-diferimento-do-imposto-sobre-operacoes-relativas-a-circulacao-de-mercadorias-e-sobre-prestacoes-de-servicos-de-transporte-interestadual-e-intermunicipal-e-de-comunicacao-icms-nas-aquisicoes-interestaduais-de-aparelhos-maquinas-equipamentos-e-instrumentos-medico-hospitalares-nas-condicoes-que-especifica-e-da-outras-providencias"
"Paraíba";"Decreto Nº 40168 de 3 de abril de 2020";"Dispõe sobre a adoção, no âmbito da Administração Pública direta e indireta, de regime de trabalho remoto, em razão das medidas temporárias e emergenciais de prevenção de contágio pelo COVID-19 (Novo Coronavírus).";"http://leisestaduais.com.br/pb/decreto-n-40168-2020-paraiba-dispoe-sobre-a-adocao-no-ambito-da-administracao-publica-direta-e-indireta-de-regime-de-trabalho-remoto-em-razao-das-medidas-temporarias-e-emergenciais-de-prevencao-de-contagio-pelo-covid-19-novo-coronavirus"
"Roraima";"Decreto Nº 28680 de 3 de abril de 2020";"Nomeia membro indicado pelo Ministério Público do Trabalho em Roraima para compor o Comitê de Crise para Enfrentamento da Emergência de Saúde Pública de Importância Internacional e Nacional decorrente do Coronavírus (COVID-19), no âmbito do Estado de Roraima.";"http://leisestaduais.com.br/rr/decreto-n-28680-2020-roraima-nomeia-membro-indicado-pelo-ministerio-publico-do-trabalho-em-roraima-para-compor-o-comite-de-crise-para-enfrentamento-da-emergencia-de-saude-publica-de-importancia-internacional-e-nacional-decorrente-do-coronavirus-covid-19-no-ambito-do-estado-de-roraima"
"Paraná";"Decreto Nº 4421 de 3 de abril de 2020";"Altera dispositivo do Decreto nº 4.263, de 18 de março de 2020.";"http://leisestaduais.com.br/pr/decreto-n-4421-2020-parana-altera-dispositivo-do-decreto-no-4-263-de-18-de-marco-de-2020"
"Amapá";"Decreto Nº 1497 de 3 de abril de 2020";"Dispõe sobre novas medidas de restrição de aglomeração de pessoas com a finalidade de reduzir os riscos de transmissão do novo Coronavírus (COVID-19), institui o Comitê de Decisões Estratégicas, e adota outras providências.";"http://leisestaduais.com.br/ap/decreto-n-1497-2020-amapa-dispoe-sobre-novas-medidas-de-restricao-de-aglomeracao-de-pessoas-com-a-finalidade-de-reduzir-os-riscos-de-transmissao-do-novo-coronavirus-covid-19-institui-o-comite-de-decisoes-estrategicas-e-adota-outras-providencias"
"Amapá";"Decreto Nº 1496 de 3 de abril de 2020";"Dispõe sobre medidas tributárias emergenciais relativas à atenuação dos efeitos econômicos decorrentes da pandemia do novo Coronavírus (COVID-19) e dá outras providências.";"http://leisestaduais.com.br/ap/decreto-n-1496-2020-amapa-dispoe-sobre-medidas-tributarias-emergenciais-relativas-a-atenuacao-dos-efeitos-economicos-decorrentes-da-pandemia-do-novo-coronavirus-covid-19-e-da-outras-providencias"
"Pernambuco";"Decreto Nº 48881 de 3 de abril de 2020";"Altera o Decreto de nº 48.832, de 19 de março de 2020, e o Decreto nº 48.834, de 20 de março de 2020, que definem no âmbito socioeconômico medidas restritivas temporárias adicionais para enfrentamento da emergência de saúde pública de importância internacional decorrente do coronavírus.";"http://leisestaduais.com.br/pe/decreto-n-48881-2020-pernambuco-altera-o-decreto-de-no-48-832-de-19-de-marco-de-2020-e-o-decreto-no-48-834-de-20-de-marco-de-2020-que-definem-no-ambito-socioeconomico-medidas-restritivas-temporarias-adicionais-para-enfrentamento-da-emergencia-de-saude-publica-de-importancia-internacional-decorrente-do-coronavirus"
"Paraíba";"Decreto Nº 40167 de 3 de abril de 2020";"Dispõe sobre a adoção de medidas sociais temporárias e emergenciais para o combate aos efeitos do COVID-19 (Novo Coronavírus), de alcance aos municípios e ao setor privado estadual.";"http://leisestaduais.com.br/pb/decreto-n-40167-2020-paraiba-dispoe-sobre-a-adocao-de-medidas-sociais-temporarias-e-emergenciais-para-o-combate-aos-efeitos-do-covid-19-novo-coronavirus-de-alcance-aos-municipios-e-ao-setor-privado-estadual"
"Goiás";"Decreto Nº 9645 de 3 de abril de 2020";"Altera o Decreto nº 9.633, de 13 de março de 2020.";"http://leisestaduais.com.br/go/decreto-n-9645-2020-goias-altera-o-decreto-no-9-633-de-13-de-marco-de-2020"
"Rio Grande do Sul";"Decreto Nº 55163 de 3 de abril de 2020";"Altera o Decreto nº 55.129, de 19 de março de 2020, que institui Gabinete de Crise para o Enfrentamento da Epidemia COVID-19, Conselho de Crise para o Enfrentamento da Epidemia COVID-19, Grupo Interinstitucional de Monitoramento das Ações de Prevenção e Mitigação dos efeitos do COVID19 no Sistema Prisional do Estado do Rio Grande do Sul e Centro de Operação de Emergência - COVID 19 (COE COVID-19) do Estado do Rio Grande do Sul.";"http://leisestaduais.com.br/rs/decreto-n-55163-2020-rio-grande-do-sul-altera-o-decreto-no-55-129-de-19-de-marco-de-2020-que-institui-gabinete-de-crise-para-o-enfrentamento-da-epidemia-covid-19-conselho-de-crise-para-o-enfrentamento-da-epidemia-covid-19-grupo-interinstitucional-de-monitoramento-das-acoes-de-prevencao-e-mitigacao-dos-efeitos-do-covid19-no-sistema-prisional-do-estado-do-rio-grande-do-sul-e-centro-de-operacao-de-emergencia-covid-19-coe-covid-19-do-estado-do-rio-grande-do-sul"
"Maranhão";"Decreto Nº 35714 de 3 de abril de 2020";"Prorroga, até 12 de abril de 2020, as medidas que especifica destinadas à prevenção do contágio e ao combate à propagação da transmissão da COVID-19, infecção humana causada pelo Coronavírus (SARS-CoV-2), altera o Decreto nº 35.677, de 21 de março de 2020, altera o Decreto nº 35.679, de 23 de março de 2020, e dá outras providências.";"http://leisestaduais.com.br/ma/decreto-n-35714-2020-maranhao-prorroga-ate-12-de-abril-de-2020-as-medidas-que-especifica-destinadas-a-prevencao-do-contagio-e-ao-combate-a-propagacao-da-transmissao-da-covid-19-infeccao-humana-causada-pelo-coronavirus-sars-cov-2-altera-o-decreto-no-35-677-de-21-de-marco-de-2020-altera-o-decreto-no-35-679-de-23-de-marco-de-2020-e-da-outras-providencias"
"Maranhão";"Decreto Nº 35713 de 3 de abril de 2020";"Prorroga, até 26 de abril de 2020, o período de suspensão das aulas presenciais nas unidades de ensino da rede estadual de educação, do Instituto Estadual de Educação, Ciência e Tecnologia do Maranhão - IEMA, da Universidade Estadual do Maranhão - UEMA e da Universidade Estadual da Região Tocantina do Maranhão - UEMASUL, nas instituições de ensino das redes municipais e nas escolas e instituições de ensino superior da rede privada localizadas no Estado do Maranhão, e o período de vedação do trânsito interestadual de ônibus ou similares, em todo o território maranhense.";"http://leisestaduais.com.br/ma/decreto-n-35713-2020-maranhao-prorroga-ate-26-de-abril-de-2020-o-periodo-de-suspensao-das-aulas-presenciais-nas-unidades-de-ensino-da-rede-estadual-de-educacao-do-instituto-estadual-de-educacao-ciencia-e-tecnologia-do-maranhao-iema-da-universidade-estadual-do-maranhao-uema-e-da-universidade-estadual-da-regiao-tocantina-do-maranhao-uemasul-nas-instituicoes-de-ensino-das-redes-municipais-e-nas-escolas-e-instituicoes-de-ensino-superior-da-rede-privada-localizadas-no-estado-do-maranhao-e-o-periodo-de-vedacao-do-transito-interestadual-de-onibus-ou-similares-em-todo-o-territorio-maranhense"
"Mato Grosso";"Decreto Nº 437 de 3 de abril de 2020";"Cria o programa ""Eu cuido de você e você cuida de mim"" em todo o território de Mato Grosso.";"http://leisestaduais.com.br/mt/decreto-n-437-2020-mato-grosso-cria-o-programa-eu-cuido-de-voce-e-voce-cuida-de-mim-em-todo-o-territorio-de-mato-grosso"
"Paraíba";"Decreto Nº 40171 de 3 de abril de 2020";"Dispõe sobre a adoção de medidas econômicas temporárias e emergenciais para o combate aos efeitos da COVID-19 (Novo Coronavírus); dispõe sobre a prorrogação dos prazos de validade das Certidões Negativas de Débitos e Certidões Positivas com Efeitos de Negativos, em decorrência da pandemia relacionada ao Coronavírus (COVID-19), e dá outras providências.";"http://leisestaduais.com.br/pb/decreto-n-40171-2020-paraiba-dispoe-sobre-a-adocao-de-medidas-economicas-temporarias-e-emergenciais-para-o-combate-aos-efeitos-da-covid-19-novo-coronavirus-dispoe-sobre-a-prorrogacao-dos-prazos-de-validade-das-certidoes-negativas-de-debitos-e-certidoes-positivas-com-efeitos-de-negativos-em-decorrencia-da-pandemia-relacionada-ao-coronavirus-covid-19-e-da-outras-providencias"
"Paraíba";"Decreto Nº 40169 de 3 de abril de 2020";"Dispõe sobre a adoção de novas medidas temporárias e emergenciais de prevenção de contágio pelo Novo Coronavírus (COVID-19).";"http://leisestaduais.com.br/pb/decreto-n-40169-2020-paraiba-dispoe-sobre-a-adocao-de-novas-medidas-temporarias-e-emergenciais-de-prevencao-de-contagio-pelo-novo-coronavirus-covid-19"
"Santa Catarina";"Decreto Nº 547 de 2 de abril de 2020";"Altera o Decreto nº 525, de 2020, a fim de dispor sobre o regime de trabalho remoto para os agentes públicos que atuam nos serviços considerados não essenciais, no âmbito da Administração Pública Estadual Direta, Autárquica e Fundacional do Poder Executivo, durante a situação de emergência de saúde pública de importância internacional decorrente do coronavírus, e estabelece outras providências.";"http://leisestaduais.com.br/sc/decreto-n-547-2020-santa-catarina-altera-o-decreto-no-525-de-2020-a-fim-de-dispor-sobre-o-regime-de-trabalho-remoto-para-os-agentes-publicos-que-atuam-nos-servicos-considerados-nao-essenciais-no-ambito-da-administracao-publica-estadual-direta-autarquica-e-fundacional-do-poder-executivo-durante-a-situacao-de-emergencia-de-saude-publica-de-importancia-internacional-decorrente-do-coronavirus-e-estabelece-outras-providencias"
"Espírito Santo";"Decreto Nº 446 de 2 de abril de 2020";"Declara Estado de Calamidade Pública no Estado do Espírito Santo decorrente de desastre natural classificado como grupo biológico/epidemias e tipo doenças infecciosas virais (COBRADE 1.5.1.1.0).";"http://leisestaduais.com.br/es/decreto-n-446-2020-espirito-santo-declara-estado-de-calamidade-publica-no-estado-do-espirito-santo-decorrente-de-desastre-natural-classificado-como-grupo-biologico-epidemias-e-tipo-doencas-infecciosas-virais-cobrade-1-5-1-1-0"
"Pernambuco";"Decreto Nº 48878 de 2 de abril de 2020";"Altera o Decreto nº 48.809, de 14 de março de 2020, que regulamenta, no Estado de Pernambuco, medidas temporárias para enfrentamento da emergência de saúde pública de importância internacional decorrente do coronavírus, conforme previsto na Lei Federal nº 13.979, de 6 de fevereiro de 2020, para definir os serviços e atividades essenciais no âmbito do Estado de Pernambuco.";"http://leisestaduais.com.br/pe/decreto-n-48878-2020-pernambuco-altera-o-decreto-no-48-809-de-14-de-marco-de-2020-que-regulamenta-no-estado-de-pernambuco-medidas-temporarias-para-enfrentamento-da-emergencia-de-saude-publica-de-importancia-internacional-decorrente-do-coronavirus-conforme-previsto-na-lei-federal-no-13-979-de-6-de-fevereiro-de-2020-para-definir-os-servicos-e-atividades-essenciais-no-ambito-do-estado-de-pernambuco"
"Minas Gerais";"Lei Ordinária Nº 23632 de 2 de abril de 2020";"Cria o Programa de Enfrentamento dos Efeitos da Pandemia de Covid-19, autoriza a abertura de crédito especial ao Orçamento Fiscal do Estado em favor das unidades orçamentárias que especifica e dá outras providências.";"http://leisestaduais.com.br/mg/lei-ordinaria-n-23632-2020-minas-gerais-cria-o-programa-de-enfrentamento-dos-efeitos-da-pandemia-de-covid-19-autoriza-a-abertura-de-credito-especial-ao-orcamento-fiscal-do-estado-em-favor-das-unidades-orcamentarias-que-especifica-e-da-outras-providencias"
"Minas Gerais";"Lei Ordinária Nº 23630 de 2 de abril de 2020";"Estabelece medidas a serem adotadas no âmbito das políticas públicas de recursos humanos durante o estado de calamidade pública em decorrência da pandemia de Covid-19, causada pelo coronavírus.";"http://leisestaduais.com.br/mg/lei-ordinaria-n-23630-2020-minas-gerais-estabelece-medidas-a-serem-adotadas-no-ambito-das-politicas-publicas-de-recursos-humanos-durante-o-estado-de-calamidade-publica-em-decorrencia-da-pandemia-de-covid-19-causada-pelo-coronavirus"
"Amazonas";"Lei Ordinária Nº 5161 de 2 de abril de 2020";"DISPÕE sobre a aquisição emergencial de insumos produzidos pelos produtores cadastrados no Edital nº 003/2019, da Agência de Desenvolvimento Sustentável, a serem doados para as Instituições cadastradas nos bancos de dados da SEJUSC, SEAS e FPS, para atender a parcela da população suscetível aos riscos ocasionados pela falta de segurança alimentar, bem como garantir alimentação no período da pandemia do Novo Coronavírus (COVID-19), bem como do remanejamento temporário de parte dos recursos destinados ao Programa de Regionalização da Merenda Escolar para distribuição de kits de alimentos, com os itens que compõem o programa, e dá outras providências.";"http://leisestaduais.com.br/am/lei-ordinaria-n-5161-2020-amazonas-dispoe-sobre-a-aquisicao-emergencial-de-insumos-produzidos-pelos-produtores-cadastrados-no-edital-no-003-2019-da-agencia-de-desenvolvimento-sustentavel-a-serem-doados-para-as-instituicoes-cadastradas-nos-bancos-de-dados-da-sejusc-seas-e-fps-para-atender-a-parcela-da-populacao-suscetivel-aos-riscos-ocasionados-pela-falta-de-seguranca-alimentar-bem-como-garantir-alimentacao-no-periodo-da-pandemia-do-novo-coronavirus-covid-19-bem-como-do-remanejamento-temporario-de-parte-dos-recursos-destinados-ao-programa-de-regionalizacao-da-merenda-escolar-para-distribuicao-de-kits-de-alimentos-com-os-itens-que-compoem-o-programa-e-da-outras-providencias"
"Tocantins";"Decreto Nº 6079 de 2 de abril de 2020";"Regulamenta o serviço de voluntário no âmbito da Administração Pública do Estado do Tocantins previsto na Lei Federal 9.608, de 18 de fevereiro de 1998, e dá outras providências.";"http://leisestaduais.com.br/to/decreto-n-6079-2020-tocantins-regulamenta-o-servico-de-voluntario-no-ambito-da-administracao-publica-do-estado-do-tocantins-previsto-na-lei-federal-9-608-de-18-de-fevereiro-de-1998-e-da-outras-providencias"
"Espírito Santo";"Decreto Nº 4621 de 2 de abril de 2020";"Dispõe sobre medidas para enfrentamento da emergência de saúde pública decorrente do novo coronavírus (COVID-19), e dá outras providências.";"http://leisestaduais.com.br/es/decreto-n-4621-2020-espirito-santo-dispoe-sobre-medidas-para-enfrentamento-da-emergencia-de-saude-publica-decorrente-do-novo-coronavirus-covid-19-e-da-outras-providencias"
"Minas Gerais";"Lei Ordinária Nº 23628 de 2 de abril de 2020";"Autoriza o Poder Executivo a suspender e prorrogar os prazos que especifica, estabelecidos na legislação tributária estadual, enquanto durar a situação de emergência ou o estado de calamidade pública em decorrência da pandemia de Covid-19, causada pelo coronavírus.";"http://leisestaduais.com.br/mg/lei-ordinaria-n-23628-2020-minas-gerais-autoriza-o-poder-executivo-a-suspender-e-prorrogar-os-prazos-que-especifica-estabelecidos-na-legislacao-tributaria-estadual-enquanto-durar-a-situacao-de-emergencia-ou-o-estado-de-calamidade-publica-em-decorrencia-da-pandemia-de-covid-19-causada-pelo-coronavirus"
"Pernambuco";"Decreto Nº 48879 de 2 de abril de 2020";"Autoriza a contratação temporária de pessoal para, no âmbito da Secretaria de Saúde, atender à situação de excepcional interesse público.";"http://leisestaduais.com.br/pe/decreto-n-48879-2020-pernambuco-autoriza-a-contratacao-temporaria-de-pessoal-para-no-ambito-da-secretaria-de-saude-atender-a-situacao-de-excepcional-interesse-publico"
"Paraná";"Lei Complementar Nº 220 de 2 de abril de 2020";"Transfere recursos do Fundo da Defensoria Pública, instituído pela Lei Complementar nº 136, de 19 de maio de 2011, para o Fundo Estadual de Saúde do Paraná, a fim de viabilizar, prioritariamente, as medidas de enfrentamento à emergência de saúde pública de importância internacional relacionada ao coronavírus SARS-CoV-2.";"http://leisestaduais.com.br/pr/lei-complementar-n-220-2020-parana-transfere-recursos-do-fundo-da-defensoria-publica-instituido-pela-lei-complementar-no-136-de-19-de-maio-de-2011-para-o-fundo-estadual-de-saude-do-parana-a-fim-de-viabilizar-prioritariamente-as-medidas-de-enfrentamento-a-emergencia-de-saude-publica-de-importancia-internacional-relacionada-ao-coronavirus-sars-cov-2"
"Minas Gerais";"Lei Ordinária Nº 23631 de 2 de abril de 2020";"Dispõe sobre a adoção de medidas para o enfrentamento do estado de calamidade pública decorrente da pandemia de Covid-19, causada por coronavírus.";"http://leisestaduais.com.br/mg/lei-ordinaria-n-23631-2020-minas-gerais-dispoe-sobre-a-adocao-de-medidas-para-o-enfrentamento-do-estado-de-calamidade-publica-decorrente-da-pandemia-de-covid-19-causada-por-coronavirus"
"Rio Grande do Sul";"Decreto Nº 55154 de 1 de abril de 2020";"Reitera a declaração de estado de calamidade pública em todo o território do Estado do Rio Grande do Sul para fins de prevenção e de enfrentamento à epidemia causada pelo COVID-19 (novo Coronavírus), e dá outras providências.";"http://leisestaduais.com.br/rs/decreto-n-55154-2020-rio-grande-do-sul-reitera-a-declaracao-de-estado-de-calamidade-publica-em-todo-o-territorio-do-estado-do-rio-grande-do-sul-para-fins-de-prevencao-e-de-enfrentamento-a-epidemia-causada-pelo-covid-19-novo-coronavirus-e-da-outras-providencias"
"Mato Grosso do Sul";"Decreto Nº 15411 de 1 de abril de 2020";"Acrescenta o art. 2º-A ao Decreto nº 15.395, de 19 de março de 2020, que institui o Regime Excepcional de Teletrabalho no âmbito da Administração Pública do Estado de Mato Grosso do Sul, para a prevenção da transmissão e da proliferação da COVID-19 no território sul-mato-grossense.";"http://leisestaduais.com.br/ms/decreto-n-15411-2020-mato-grosso-do-sul-acrescenta-o-art-2o-a-ao-decreto-no-15-395-de-19-de-marco-de-2020-que-institui-o-regime-excepcional-de-teletrabalho-no-ambito-da-administracao-publica-do-estado-de-mato-grosso-do-sul-para-a-prevencao-da-transmissao-e-da-proliferacao-da-covid-19-no-territorio-sul-mato-grossense"
"Mato Grosso do Sul";"Decreto Nº 29 de 1 de abril de 2020";"Declara ponto facultativo, para os órgãos e as entidades da Administração Direta, Autárquica e Fundacional do Poder Executivo Estadual, nos termos que especifica.";"http://leisestaduais.com.br/ms/decreto-n-29-2020-mato-grosso-do-sul-declara-ponto-facultativo-para-os-orgaos-e-as-entidades-da-administracao-direta-autarquica-e-fundacional-do-poder-executivo-estadual-nos-termos-que-especifica"
"Distrito Federal";"Decreto Nº 40584 de 1 de abril de 2020";"Institui medidas de transparência e prioridade aos processos relativos à atual situação de emergência em saúde pública e pandemia declarada pela Organização Mundial de Saúde (OMS), em decorrência do novo coronavírus (COVID-19), e dá outras providências.";"http://leisestaduais.com.br/df/decreto-n-40584-2020-distrito-federal-institui-medidas-de-transparencia-e-prioridade-aos-processos-relativos-a-atual-situacao-de-emergencia-em-saude-publica-e-pandemia-declarada-pela-organizacao-mundial-de-saude-oms-em-decorrencia-do-novo-coronavirus-covid-19-e-da-outras-providencias"
"Distrito Federal";"Decreto Nº 40583 de 1 de abril de 2020";"Dispõe sobre as medidas para enfrentamento da emergência de saúde pública de importância internacional decorrente do novo coronavírus.";"http://leisestaduais.com.br/df/decreto-n-40583-2020-distrito-federal-dispoe-sobre-as-medidas-para-enfrentamento-da-emergencia-de-saude-publica-de-importancia-internacional-decorrente-do-novo-coronavirus"
"Pernambuco";"Decreto Nº 48876 de 1 de abril de 2020";"Prorroga a validade dos Atestados de Regularidade emitidos pelo Corpo de Bombeiros Militar de Pernambuco.";"http://leisestaduais.com.br/pe/decreto-n-48876-2020-pernambuco-prorroga-a-validade-dos-atestados-de-regularidade-emitidos-pelo-corpo-de-bombeiros-militar-de-pernambuco"
"Mato Grosso do Sul";"Decreto Nº 15410 de 1 de abril de 2020";"Acrescenta o art. 2º-B ao Decreto nº 15.391, de 16 de março de 2020, que dispõe sobre as medidas temporárias a serem adotadas, no âmbito da Administração Pública do Estado de Mato Grosso do Sul, para a prevenção do contágio da doença COVID-19 e enfrentamento da emergência de saúde pública da importância internacional decorrente do coronavírus (SARS-CoV-2), no território sul-mato-grossense.";"http://leisestaduais.com.br/ms/decreto-n-15410-2020-mato-grosso-do-sul-acrescenta-o-art-2o-b-ao-decreto-no-15-391-de-16-de-marco-de-2020-que-dispoe-sobre-as-medidas-temporarias-a-serem-adotadas-no-ambito-da-administracao-publica-do-estado-de-mato-grosso-do-sul-para-a-prevencao-do-contagio-da-doenca-covid-19-e-enfrentamento-da-emergencia-de-saude-publica-da-importancia-internacional-decorrente-do-coronavirus-sars-cov-2-no-territorio-sul-mato-grossense"
"Rio Grande do Norte";"Decreto Nº 29583 de 1 de abril de 2020";"Consolida as medidas de saúde para o enfrentamento do novo coronavírus (COVID-19) no âmbito do Estado do Rio Grande do Norte e dá outras providências.";"http://leisestaduais.com.br/rn/decreto-n-29583-2020-rio-grande-do-norte-consolida-as-medidas-de-saude-para-o-enfrentamento-do-novo-coronavirus-covid-19-no-ambito-do-estado-do-rio-grande-do-norte-e-da-outras-providencias"
"Roraima";"Decreto Nº 28674 de 1 de abril de 2020";"Altera o Decreto nº 28.635-E, de 22 de março de 2020, que declara estado de calamidade pública em todo o território do Estado de Roraima para fins de prevenção e enfrentamento à epidemia causada pelo COVID-19 (Coronavírus), o Decreto nº 28.657-E, de 25 de março de 2020, que dispõe sobre a criação do Comitê de Crise para Enfrentamento da Emergência de Saúde Pública de Importância Internacional e Nacional decorrente do Coronavírus e o Decreto nº 28.662-E, de 27 de março de 2020, que dispõe sobre medidas excepcionais e temporárias aplicáveis à iniciativa privada para prevenir e diminuir o risco de contágio e disseminação do Coronavírus.";"http://leisestaduais.com.br/rr/decreto-n-28674-2020-roraima-altera-o-decreto-no-28-635-e-de-22-de-marco-de-2020-que-declara-estado-de-calamidade-publica-em-todo-o-territorio-do-estado-de-roraima-para-fins-de-prevencao-e-enfrentamento-a-epidemia-causada-pelo-covid-19-coronavirus-o-decreto-no-28-657-e-de-25-de-marco-de-2020-que-dispoe-sobre-a-criacao-do-comite-de-crise-para-enfrentamento-da-emergencia-de-saude-publica-de-importancia-internacional-e-nacional-decorrente-do-coronavirus-e-o-decreto-no-28-662-e-de-27-de-marco-de-2020-que-dispoe-sobre-medidas-excepcionais-e-temporarias-aplicaveis-a-iniciativa-privada-para-prevenir-e-diminuir-o-risco-de-contagio-e-disseminacao-do-coronavirus"
"Amapá";"Lei Ordinária Nº 2499 de 1 de abril de 2020";"Institui auxílio financeiro emergencial para atender famílias em vulnerabilidade social, agravado pela calamidade pública e econômica advindas da pandemia COVID-19, e dá outras providências.";"http://leisestaduais.com.br/ap/lei-ordinaria-n-2499-2020-amapa-institui-auxilio-financeiro-emergencial-para-atender-familias-em-vulnerabilidade-social-agravado-pela-calamidade-publica-e-economica-advindas-da-pandemia-covid-19-e-da-outras-providencias"
"São Paulo";"Decreto Nº 59321 de 1 de abril de 2020";"Regulamenta a Lei nº 17.335, de 27 de março de 2020, que dispõe sobre a autorização de medidas excepcionais no âmbito dos contratos administrativos de prestação de serviços, finanças públicas e outras medidas em face da situação de emergência e estado de calamidade pública decorrentes do coronavírus, no âmbito do Município de São Paulo.";"http://leisestaduais.com.br/sp/decreto-n-59321-2020-sao-paulo-regulamenta-a-lei-no-17-335-de-27-de-marco-de-2020-que-dispoe-sobre-a-autorizacao-de-medidas-excepcionais-no-ambito-dos-contratos-administrativos-de-prestacao-de-servicos-financas-publicas-e-outras-medidas-em-face-da-situacao-de-emergencia-e-estado-de-calamidade-publica-decorrentes-do-coronavirus-no-ambito-do-municipio-de-sao-paulo"
"Distrito Federal";"Decreto Nº 40586 de 1 de abril de 2020";"Dispõe sobre o adiamento das Comemorações aos 60 Anos de Brasília.";"http://leisestaduais.com.br/df/decreto-n-40586-2020-distrito-federal-dispoe-sobre-o-adiamento-das-comemoracoes-aos-60-anos-de-brasilia"
"Rio de Janeiro";"Decreto Nº 47009 de 31 de março de 2020";"DISPÕE SOBRE O GABINETE DE GERENCIAMENTO DE INFORMAÇÕES PARA SUBSIDIAR OS ATOS DECISÓRIOS DO GOVERNO DO ESTADO.";"http://leisestaduais.com.br/rj/decreto-n-47009-2020-rio-de-janeiro-dispoe-sobre-o-gabinete-de-gerenciamento-de-informacoes-para-subsidiar-os-atos-decisorios-do-governo-do-estado"
"São Paulo";"Decreto Nº 64897 de 31 de março de 2020";"Autoriza o funcionamento extraordinário das unidades do Restaurante Popular, instituído pelo Decreto nº 45.547, de 26 de dezembro de 2000, no contexto da pandemia COVID-19 (Novo Coronavírus), e dá providências correlatas.";"http://leisestaduais.com.br/sp/decreto-n-64897-2020-sao-paulo-autoriza-o-funcionamento-extraordinario-das-unidades-do-restaurante-popular-instituido-pelo-decreto-no-45-547-de-26-de-dezembro-de-2000-no-contexto-da-pandemia-covid-19-novo-coronavirus-e-da-providencias-correlatas"
