"mun";"lei";"desc";"link";"UF";"lei_ord";"ata";"decreto";"medida";"oficio";"portaria";"resolucao";"data";"codmun";"id_munic_7";"id_estado"
"Patos de Minas";"Decreto Nº 4807 de 8 de abril de 2020";"Dispõe sobre a suspensão de atividades comerciais, inclusive as relativas à produção industrial e de serviços que especifica e dá outras providências.";"http://leismunicipa.is/egydh";"MG";0;0;1;0;0;0;0;2020-04-08;314800;3148004;31
"Bragança Paulista";"Decreto Nº 3248 de 8 de abril de 2020";"Prorroga o prazo de vigência da situação de emergência declarada através do Decreto nº 3.166, de 17 de janeiro de 2020.";"http://leismunicipa.is/mdkye";"SP";0;0;1;0;0;0;0;2020-04-08;350760;3507605;35
"Recife";"Portaria do Executivo Nº 883 de 8 de abril de 2020";"O PREFEITO DO RECIFE, no uso de suas atribuições, e tendo em vista o contido no ofício nº 354/2020 - GAB/SEDUC;";"http://leismunicipa.is/dbeyc";"PE";0;0;0;0;0;1;0;2020-04-08;261160;2611606;26
"Patos de Minas";"Decreto Nº 4806 de 8 de abril de 2020";"Altera a redação do art. 2º do Decreto nº 4.805, de 7 de abril de 2020, que <U+0093>Instituiu e Dispõe sobre a estrutura organizacional do Comitê Municipal de Enfrentamento  ao Coronavíru...";"http://leismunicipa.is/hgyde";"MG";0;0;1;0;0;0;0;2020-04-08;314800;3148004;31
"Macapá";"Decreto Nº 1855 de 8 de abril de 2020";"DISPÕE SOBRE AS PRORROGAÇÕES DOS DECRETOS MUNICIPAIS Nº 1626, 14 DE MARÇO DE 2020 E Nº 1654, DE 16 DE MARÇO DE 2020.";"http://leismunicipa.is/amhyj";"AP";0;0;1;0;0;0;0;2020-04-08;160030;1600303;16
"Itapevi";"Decreto Nº 5541 de 7 de abril de 2020";"<U+0093>DISPÕE SOBRE NOVAS MEDIDAS PARA ENFRENTAMENTO DA EMERGÊNCIA EM SAÚDE PÚBLICA DE IMPORTÂNCIA INTERNACIONAL DECORRENTE DO NOVO CORONAVÍRUS E DÁ OUTRAS PROVIDÊNCIAS.<U+0094>";"http://leismunicipa.is/vwhxs";"SP";0;0;1;0;0;0;0;2020-04-07;352250;3522505;35
"São Paulo";"Decreto Nº 59338 de 7 de abril de 2020";"Disciplina o cômputo de faltas e o pagamento de benefícios para os beneficiários do Programa Operação Trabalho, regulamentado pelo Decreto nº 44.484, de 10 de março de 2004, enquan...";"http://leismunicipa.is/fvswx";"SP";0;0;1;0;0;0;0;2020-04-07;355030;3550308;35
"Patos de Minas";"Decreto Nº 4805 de 7 de abril de 2020";"Instituiu e Dispõe sobre a estrutura organizacional do Comitê Municipal de Enfrentamento  ao Coronavírus (COVID-19) no município de Patos de Minas.";"http://leismunicipa.is/dyhge";"MG";0;0;1;0;0;0;0;2020-04-07;314800;3148004;31
"Salvador";"Decreto Nº 32332 de 7 de abril de 2020";"Dispõe sobre novas medidas de prevenção e controle para enfrentamento do COVID-19 no âmbito do município de Salvador.";"http://leismunicipa.is/fdyce";"BA";0;0;1;0;0;0;0;2020-04-07;292740;2927408;29
"Florianópolis";"Decreto Nº 21421 de 7 de abril de 2020";"PRORROGA AS MEDIDAS DE ENFRENTAMENTO AO COVID-19 E DÁ OUTRAS PROVIDÊNCIAS.";"http://leismunicipa.is/wsqvx";"SC";0;0;1;0;0;0;0;2020-04-07;420540;4205407;42
"Sorocaba";"Decreto Nº 25686 de 7 de abril de 2020";"(Estende o prazo das restrições impostas no Decreto nº 25.663, de 21 de março de 2020 e dá outras providências).";"http://leismunicipa.is/bhygf";"SP";0;0;1;0;0;0;0;2020-04-07;355220;3552205;35
"Criciúma";"Lei Ordinária Nº 7678 de 7 de abril de 2020";"Reduz temporariamente os valores de Funções Gratificadas, Funções de Confiança e Gratificações, em decorrência das ações para a contenção do coronavírus no município de Criciúma e ...";"http://leismunicipa.is/cagyj";"SC";1;0;0;0;0;0;0;2020-04-07;420460;4204608;42
"Santos";"Decreto Nº 8932 de 7 de abril de 2020";"ADOTA MEDIDAS ADICIONAIS AOS DECRETOS Nº 8.896, DE 19 DE MARÇO DE 2020, E Nº 8.898, DE 20 DE MARÇO DE 2020, DÁ OUTRAS PROVIDÊNCIAS.";"http://leismunicipa.is/yadcj";"SP";0;0;1;0;0;0;0;2020-04-07;354850;3548500;35
"Florianópolis";"Decreto Nº 21423 de 7 de abril de 2020";"RETIFICA O DECRETO Nº 21.352, DE 17 DE MARÇO DE 2020.";"http://leismunicipa.is/qvwxs";"SC";0;0;1;0;0;0;0;2020-04-07;420540;4205407;42
"São Paulo";"Decreto Nº 59337 de 7 de abril de 2020";"Estabelece diretrizes para engajamento do Poder Público Municipal no movimento da sociedade civil de São Paulo denominado Cidade Solidária, instituído para prover ajuda humanitária...";"http://leismunicipa.is/xwfsv";"SP";0;0;1;0;0;0;0;2020-04-07;355030;3550308;35
"Manaus";"Decreto Nº 4795 de 6 de abril de 2020";"DISPÕE sobre a cassação e interdição de estabelecimentos empresariais que especifica pelo descumprimento de medidas para enfrentamento da pandemia do COVID-19, e dá outras providên...";"http://leismunicipa.is/lxtwv";"AM";0;0;1;0;0;0;0;2020-04-06;130260;1302603;13
"Uberaba";"Decreto Nº 5443 de 6 de abril de 2020";"Recepciona, Ratifica e, por consequência de causa e efeito, DECLARA ESTADO DE CALAMIDADE PÚBLICA no Município de Uberaba, Estado de Minas Gerais, decorrente do Coronavírus <U+0096> COVID-...";"http://leismunicipa.is/wxqva";"MG";0;0;1;0;0;0;0;2020-04-06;317010;3170107;31
"Niterói";"Decreto Nº 13541 de 6 de abril de 2020";"Regulamenta a Renda Básica Temporária, instituída pela Lei nº 3.480/2020, elaborada no contexto do enfrentamento aos efeitos econômicos do COVID-19.";"http://leismunicipa.is/xqwmv";"RJ";0;0;1;0;0;0;0;2020-04-06;330330;3303302;33
"Manaus";"Decreto Nº 4796 de 6 de abril de 2020";"DISPÕE sobre o bloqueio temporário da venda e utilização de cartões de meia-passagem estudantil e da concessão de gratuidade a idosos no transporte coletivo de passageiros no Munic...";"http://leismunicipa.is/ltxwv";"AM";0;0;1;0;0;0;0;2020-04-06;130260;1302603;13
"Osasco";"Decreto Nº 12429 de 6 de abril de 2020";"Prorroga a quarentena no Município de Osasco, no contexto da pandemia da COVID-19 (Novo Coronavírus).";"http://leismunicipa.is/wsvxk";"SP";0;0;1;0;0;0;0;2020-04-06;353440;3534401;35
"Uberaba";"Decreto Nº 5437 de 6 de abril de 2020";"Altera o Decreto n. 5378/2020, que <U+0093>Cria, no âmbito do Município de Uberaba, Estado de Minas Gerais, Grupo de Trabalho Financeiro e Orçamentário, decorrente do estado de emergência...";"http://leismunicipa.is/vwqax";"MG";0;0;1;0;0;0;0;2020-04-06;317010;3170107;31
"Taboão da Serra";"Decreto Nº 76 de 6 de abril de 2020";"Dispõe sobre: Estabelecimento de normas administrativas complementares às dispostas nos Decretos nº 59, de 16/03/2020 que trata da declaração de Situação de Emergência e nº 68, de ...";"http://leismunicipa.is/xwvtn";"SP";0;0;1;0;0;0;0;2020-04-06;355280;3552809;35
"Uberaba";"Decreto Nº 5444 de 6 de abril de 2020";"Impõe, no âmbito do Município de Uberaba, Estado de Minas Gerais, medidas de proteção à coletividade a serem adotadas para enfrentamento da emergência de saúde pública de importânc...";"http://leismunicipa.is/vqxaw";"MG";0;0;1;0;0;0;0;2020-04-06;317010;3170107;31
"Niterói";"Decreto Nº 13536 de 3 de abril de 2020";"Dispõe sobre medidas de prevenção para o enfrentamento da pandemia de Covid19, o novo coronavírus, nos estabelecimentos comerciais em funcionamento.";"http://leismunicipa.is/jxdwv";"RJ";0;0;1;0;0;0;0;2020-04-03;330330;3303302;33
"Salvador";"Decreto Nº 32326 de 3 de abril de 2020";"Dispõe sobre novas medidas de prevenção e controle para enfrentamento do COVID-19 no âmbito do município de Salvador.";"http://leismunicipa.is/wcxvq";"BA";0;0;1;0;0;0;0;2020-04-03;292740;2927408;29
"Uberaba";"Decreto Nº 5427 de 3 de abril de 2020";"Estabelece ponto facultativo nas repartições públicas que menciona e dá outras providências.";"http://leismunicipa.is/wnvqx";"MG";0;0;1;0;0;0;0;2020-04-03;317010;3170107;31
"Itapevi";"Decreto Nº 5540 de 3 de abril de 2020";"<U+0093>DISPÕE SOBRE A REGULAMENTAÇÃO DA LEI 2.785, DE 03 DE ABRIL DE 2020 QUE AUTORIZA O PODER EXECUTIVO CONCEDER ABONO EXTRAORDINÁRIO AOS PROFISSIONAIS DA SÁUDE, EM RAZAO DO ENFRENTAMEN...";"http://leismunicipa.is/nvxwh";"SP";0;0;1;0;0;0;0;2020-04-03;352250;3522505;35
"Osasco";"Decreto Nº 12426 de 3 de abril de 2020";"Prorroga, automaticamente, a vigência dos contratos de locação beneficiados pelo Programa Bolsa Aluguel de que trata a Lei 4621/2014, em razão da pandemia mundial do Coronavírus (C...";"http://leismunicipa.is/xsvkw";"SP";0;0;1;0;0;0;0;2020-04-03;353440;3534401;35
"Camboriú";"Lei Ordinária Nº 3232 de 3 de abril de 2020";"Dispõe sobre a concessão de ajuda de custo na forma de diária aos servidores atuantes na Secretaria Municipal de Saúde no período em que perdurar a Emergência em Saúde Pública de I...";"http://leismunicipa.is/gwnxv";"SC";1;0;0;0;0;0;0;2020-04-03;420320;4203204;42
"Itapevi";"Lei Ordinária Nº 2785 de 3 de abril de 2020";"""AUTORIZA O PODER EXECUTIVO CONCEDER ABONO EXTRAORDINÁRIO AOS PROFISSIONAIS DA SÁUDE, EM RAZAO DO ENFRENTAMENRO DIRETO E FRONTAL AO NOVO CORONA VÍRUS - COVID-19, E DÁ OUTRAS PROVID...";"http://leismunicipa.is/wvnxj";"SP";1;0;0;0;0;0;0;2020-04-03;352250;3522505;35
"Porto Alegre";"Decreto Nº 20540 de 3 de abril de 2020";"Altera o caput do art. 10, os incs. XIV, XXIV e XXX do art. 11, o inc. XIV do art. 12, o parágrafo único do art. 13, os caput e o § 7º do art. 14, o caput do art. 49, o caput do ar...";"http://leismunicipa.is/lwxvo";"RS";0;0;1;0;0;0;0;2020-04-03;431490;4314902;43
"Macapá";"Decreto Nº 1833 de 3 de abril de 2020";"DISPÕE SOBRE OS HORÁRIOS DE FUNCIONAMENTO DOS ESTABELECIMENTOS COMERCIAIS DE PRODUTOS E SERVIÇOS, E DÁ OUTRAS PROVIDÊNCIAS.";"http://leismunicipa.is/yahmj";"AP";0;0;1;0;0;0;0;2020-04-03;160030;1600303;16
"Camboriú";"Lei Ordinária Nº 3230 de 3 de abril de 2020";"Dispõe sobre a revisão geral anual do vencimento dos servidores públicos e da atualização do vencimento dos profissionais do magistério do Município de Camboriú para o exercício de...";"http://leismunicipa.is/xgwnv";"SC";1;0;0;0;0;0;0;2020-04-03;420320;4203204;42
"Camboriú";"Lei Ordinária Nº 3231 de 3 de abril de 2020";"Altera a Lei Municipal nº 3.083, de 08 de outubro de 2018.";"http://leismunicipa.is/gwxnv";"SC";1;0;0;0;0;0;0;2020-04-03;420320;4203204;42
"Santos";"Decreto Nº 8910 de 3 de abril de 2020";"ADOTA MEDIDAS ADICIONAIS AO DECRETO Nº 8.896, DE 19 DE MARÇO DE 2020, E DÁ OUTRAS PROVIDÊNCIAS.";"http://leismunicipa.is/lvowx";"SP";0;0;1;0;0;0;0;2020-04-03;354850;3548500;35
"Camboriú";"Decreto Nº 3651 de 3 de abril de 2020";"DISPÕE SOBRE MEDIDAS ADMINISTRATIVAS NO ÂMBITO DO MUNICÍPIO DE CAMBORIÚ EM DECORRÊNCIA DA SITUAÇÃO DE EMERGÊNCIA DE SAÚDE PÚBLICA DE IMPORTÂNCIA INTERNACIONAL DECORRENTE DO NOVO CO...";"http://leismunicipa.is/wvtsx";"SC";0;0;1;0;0;0;0;2020-04-03;420320;4203204;42
"Uberaba";"Decreto Nº 5425 de 3 de abril de 2020";"DISPÕE SOBRE A DESIGNAÇÃO PARA O EXERCÍCIO DA FUNÇÃO PÚBLICA TEMPORÁRIA DE ASSISTENTE SOCIAL, E DÁ OUTRAS PROVIDÊNCIAS.";"http://leismunicipa.is/oxwqv";"MG";0;0;1;0;0;0;0;2020-04-03;317010;3170107;31
"Uberaba";"Decreto Nº 5426 de 3 de abril de 2020";"Determina a ocupação e consequente utilização dos prédios públicos que menciona para o fim de implantação do Centro de Processamento de Alimentos em razão da necessidade de enfrent...";"http://leismunicipa.is/vmwxq";"MG";0;0;1;0;0;0;0;2020-04-03;317010;3170107;31
"Manaus";"Lei Ordinária Nº 2596 de 3 de abril de 2020";"DISPÕE sobre a concessão de bolsa-auxílio emergencial, em razão da pandemia causada pelo novo Coronavírus (COVID-19), e dá outras providências.";"http://leismunicipa.is/vwqnx";"AM";1;0;0;0;0;0;0;2020-04-03;130260;1302603;13
"Florianópolis";"Decreto Nº 21401 de 3 de abril de 2020";"ESTABELECE MEDIDAS ADMINISTRATIVAS PARA O CONTROLE DA DESPESA PÚBLICA COM PUBLICIDADE NO MUNICÍPIO DE FLORIANÓPOLIS DURANTE AS MEDIDAS DE ENFRENTAMENTO AO COVID-19.";"http://leismunicipa.is/vxwqn";"SC";0;0;1;0;0;0;0;2020-04-03;420540;4205407;42
"Niterói";"Lei Ordinária Nº 3484 de 2 de abril de 2020";"Dispõe sobre autorização para repasse, por meio de convênio, de R$ 45.000.000,00 (quarenta e cinco milhões de reais) ao Estado do Rio de Janeiro para instalação de hospital de camp...";"http://leismunicipa.is/jdwxv";"RJ";1;0;0;0;0;0;0;2020-04-02;330330;3303302;33
"Niterói";"Lei Ordinária Nº 3482 de 2 de abril de 2020";"Institui o Programa Empresa Cidadã de Niterói como medida para a mtigação dos impactos econômicos decorrentes da epidemia do coronavírus (covid-19) no município de Niterói.";"http://leismunicipa.is/jxdvw";"RJ";1;0;0;0;0;0;0;2020-04-02;330330;3303302;33
"Florianópolis";"Decreto Nº 21389 de 2 de abril de 2020";"ESTABELECE MEDIDAS ADMINISTRATIVAS PARA O CONTROLE DA DESPESA PÚBLICA COM FOLHA DE PAGAMENTO DOS SERVIDORES MUNICIPAIS DECORRENTES DAS MEDIDAS DE ENFRENTAMENTO AO COVID-19 E ADOTA ...";"http://leismunicipa.is/wfkxv";"SC";0;0;1;0;0;0;0;2020-04-02;420540;4205407;42
"Florianópolis";"Resolução Nº 2439 de 2 de abril de 2020";"CONVALIDA O SISTEMA DE DELIBERA??O DIGITAL -SDD-, INSTRUMENTO EXCEPCIONAL E TEMPOR?RIO DESTINADO A VIABILIZAR O FUNCIONAMENTO DO PLEN?RIO DA C?MARA MUNICIPAL DE FLORIAN?POLIS DURAN...";"http://leismunicipa.is/yaeil";"SC";0;0;0;0;0;0;1;2020-04-02;420540;4205407;42
"Uberlândia";"Decreto Nº 18575 de 2 de abril de 2020";"DISPÕE ACERCA DO CONTINGENCIAMENTO DAS DESPESAS DA ADMINISTRAÇÃO PÚBLICA MUNICIPAL EM DECORRÊNCIA DO QUADRO DE PANDEMIA ADVINDO DO NOVO CORONAVÍRUS <U+0096> COVID-19.";"http://leismunicipa.is/vjwax";"MG";0;0;1;0;0;0;0;2020-04-02;317020;3170206;31
"Camboriú";"Decreto Nº 3650 de 2 de abril de 2020";"DISPÕE SOBRE A PRORROGAÇÃO E SUSPENSÃO DOS PRAZOS DE VENCIMENTOS DOS TRIBUTOS QUE ESPECIFICA EM DECORRÊNCIA DA SITUAÇÃO DE EMERGÊNCIA DE SAÚDE PÚBLICA DE IMPORTÂNCIA INTERNACIONAL ...";"http://leismunicipa.is/wvxts";"SC";0;0;1;0;0;0;0;2020-04-02;420320;4203204;42
"Niterói";"Lei Ordinária Nº 3483 de 2 de abril de 2020";"Fica o Poder Executivo autorizado a abrir um crédito especial no valor de R$ 45.000.000,00 (quarenta e cinco milhões de reais), para ações de combate ao covid19, em especial o repa...";"http://leismunicipa.is/xjdvw";"RJ";1;0;0;0;0;0;0;2020-04-02;330330;3303302;33
"Bragança Paulista";"Decreto Nº 3244 de 2 de abril de 2020";"Institui o Comitê de Crise para Supervisão e Monitoramento dos Impactos da Covid-19.";"http://leismunicipa.is/kmyde";"SP";0;0;1;0;0;0;0;2020-04-02;350760;3507605;35
"São Paulo";"Decreto Nº 59326 de 2 de abril de 2020";"Estabelece medidas para redução do impacto social e econômico decorrente das providências de restrição adotadas para o enfrentamento da pandemia ocasionada pelo coronavírus.";"http://leismunicipa.is/fxivw";"SP";0;0;1;0;0;0;0;2020-04-02;355030;3550308;35
"Osasco";"Decreto Nº 12425 de 2 de abril de 2020";"Declara situação de Estado de Calamidade Pública no Município de Osasco, em razão da pandemia decorrente do Coronavírus (COVID-19).";"http://leismunicipa.is/swvlx";"SP";0;0;1;0;0;0;0;2020-04-02;353440;3534401;35
"Niterói";"Lei Ordinária Nº 3481 de 2 de abril de 2020";"Institui o Fundo de Crédito Emergencial do Município de Niterói, criado no contexto das medidas para o enfrentamento econômico da epidemia do vírus COVID-19.";"http://leismunicipa.is/jdxwv";"RJ";1;0;0;0;0;0;0;2020-04-02;330330;3303302;33
"Niterói";"Decreto Nº 13534 de 1 de abril de 2020";"DISPÕE SOBRE A REDUÇÃO DA CIRCULAÇÃO NOS ACESSOS DE NITERÓI COM MUNICÍPIOS VIZINHOS POR QUATORZE DIAS.";"http://leismunicipa.is/vwdxa";"RJ";0;0;1;0;0;0;0;2020-04-01;330330;3303302;33
"Florianópolis";"Decreto Nº 21388 de 1 de abril de 2020";"ESTABELECE AS REGRAS DE OPERAÇÃO DO PROGRAMA JURO ZERO FLORIPA DURANTE A VIGÊNCIA DAS AÇÕES DE ENFRENTAMENTO AO COVID-19, ALTERA O DECRETO Nº 17.809, DE 2017 E DÁ OUTRAS PROVIDÊNCI...";"http://leismunicipa.is/fxvwe";"SC";0;0;1;0;0;0;0;2020-04-01;420540;4205407;42
"Salvador";"Decreto Nº 32320 de 1 de abril de 2020";"Define medidas para o funcionamento das agências bancárias.";"http://leismunicipa.is/evxnw";"BA";0;0;1;0;0;0;0;2020-04-01;292740;2927408;29
"Uberaba";"Decreto Nº 5418 de 1 de abril de 2020";"DISPÕE SOBRE A DESIGNAÇÃO PARA O EXERCÍCIO DA FUNÇÃO PÚBLICA TEMPORÁRIA DE MÉDICO(A) PARA O PROGRAMA RENOVA SAÚDE, E DÁ OUTRAS PROVIDÊNCIAS.";"http://leismunicipa.is/kqwxv";"MG";0;0;1;0;0;0;0;2020-04-01;317010;3170107;31
"São Paulo";"Decreto Nº 59321 de 1 de abril de 2020";"Regulamenta a Lei nº 17.335, de 27 de março de 2020, que dispõe sobre a autorização de medidas excepcionais no âmbito dos contratos administrativos de prestação de serviços, finanç...";"http://leismunicipa.is/twumx";"SP";0;0;1;0;0;0;0;2020-04-01;355030;3550308;35
"Niterói";"Decreto Nº 13533 de 1 de abril de 2020";"Dispõe sobre a suspensão das aulas nas instituições educacionais que integram o Sistema Municipal de Ensino de Niterói, em razão da epidemia provocada pelo novo Coronavírus.";"http://leismunicipa.is/wxvda";"RJ";0;0;1;0;0;0;0;2020-04-01;330330;3303302;33
"Recife";"Decreto Nº 33580 de 1 de abril de 2020";"Suspende os processos administrativos instaurados a partir de autos de infração de que resultem a aplicação de penalidade pecuniária, tratados na Lei Municipal nº 18.352, de 19 de ...";"http://leismunicipa.is/vwxib";"PE";0;0;1;0;0;0;0;2020-04-01;261160;2611606;26
"Uberaba";"Decreto Nº 5417 de 1 de abril de 2020";"DISPÕE SOBRE A DESIGNAÇÃO, PARA O EXERCÍCIO DA FUNÇÃO PÚBLICA TEMPORÁRIA DE TÉCNICO DE ENFERMAGEM, E DÁ OUTRAS PROVIDÊNCIAS.";"http://leismunicipa.is/xvkwq";"MG";0;0;1;0;0;0;0;2020-04-01;317010;3170107;31
"Cabo de Santo Agostinho";"Decreto Nº 1882 de 1 de abril de 2020";"Dispõe sobre a contratação temporária no âmbito da Secretaria Municipal de Saúde do Município do Cabo de Santo Agostinho para o enfrentamento do Coronavírus (COVID-19), e dá outras...";"http://leismunicipa.is/mdyge";"PE";0;0;1;0;0;0;0;2020-04-01;260290;2602902;26
"Uberaba";"Decreto Nº 5419 de 1 de abril de 2020";"DISPÕE SOBRE A DESIGNAÇÃO, PARA O EXERCÍCIO DA FUNÇÃO PÚBLICA TEMPORÁRIA DE DENTISTA PLANTONISTA, E DÁ OUTRAS PROVIDÊNCIAS.";"http://leismunicipa.is/xnwqv";"MG";0;0;1;0;0;0;0;2020-04-01;317010;3170107;31
"Cabo de Santo Agostinho";"Decreto Nº 1883 de 1 de abril de 2020";"Dispõe sobre a prorrogação de prazo relativo ao ISS, em virtude de <U+0093>Estado de Calamidade Pública<U+0094>, e dá outras providências.";"http://leismunicipa.is/gdeym";"PE";0;0;1;0;0;0;0;2020-04-01;260290;2602902;26
"Macapá";"Decreto Nº 1799 de 1 de abril de 2020";"DISPÕE SOBRE A PRORROGAÇÃO DO PRAZO ESTABELECIDO NO ARTIGO 1º DO DECRETO Nº 1656, DE 16 DE MARÇO DE 2020.";"http://leismunicipa.is/ajhym";"AP";0;0;1;0;0;0;0;2020-04-01;160030;1600303;16
"Sorocaba";"Decreto Nº 25679 de 1 de abril de 2020";"(Dispõe sobre alteração no orçamento vigente e dá outras providências).";"http://leismunicipa.is/fmcyg";"SP";0;0;1;0;0;0;0;2020-04-01;355220;3552205;35
"Uberaba";"Decreto Nº 5416 de 1 de abril de 2020";"DISPÕE SOBRE A DESIGNAÇÃO, PARA O EXERCÍCIO DA FUNÇÃO PÚBLICA TEMPORÁRIA DE TÉCNICO DE ENFERMAGEM, E DÁ OUTRAS PROVIDÊNCIAS.";"http://leismunicipa.is/wkxqv";"MG";0;0;1;0;0;0;0;2020-04-01;317010;3170107;31
"Patos de Minas";"Decreto Nº 4802 de 1 de abril de 2020";"Estabelece prazo  para apresentação de relatório e planilhas a fim de promover a revisão da Planta Genérica de Valores - PGV.";"http://leismunicipa.is/mnvxw";"MG";0;0;1;0;0;0;0;2020-04-01;314800;3148004;31
"São Bernardo do Campo";"Portaria da Presidência Nº 3158 de 1 de abril de 2020";"Constitui Comissão Especial.";"http://leismunicipa.is/ehidy";"SP";0;0;0;0;0;1;0;2020-04-01;354870;3548708;35
"Florianópolis";"Decreto Nº 21381 de 31 de março de 2020";"REVOGA DISPOSITIVOS DO DECRETO Nº 21.368, DE 2020.";"http://leismunicipa.is/xuqwf";"SC";0;0;1;0;0;0;0;2020-03-31;420540;4205407;42
"Osasco";"Decreto Nº 12420 de 31 de março de 2020";"Antecipa o recesso escolar de julho de 2020, em razão da pandemia mundial do Coronavírus (COVID-19).";"http://leismunicipa.is/xviwg";"SP";0;0;1;0;0;0;0;2020-03-31;353440;3534401;35
"Sorocaba";"Decreto Nº 25676 de 31 de março de 2020";"(Altera dispositivos do Decreto nº 25.663, de 21 de março de 2020, que reconhece o estado de calamidade pública decorrente da pandemia do COVID-19, que atinge o Município de Soroca...";"http://leismunicipa.is/xwruh";"SP";0;0;1;0;0;0;0;2020-03-31;355220;3552205;35
"Sorocaba";"Portaria do Executivo Nº 22949 de 31 de março de 2020";"(Altera dispositivos da Portaria nº 22.944, de 17 de março de 2020, que estabelece medidas de caráter temporário visando reduzir exposição pessoal e interações presenciais entre se...";"http://leismunicipa.is/xrwuh";"SP";0;0;0;0;0;1;0;2020-03-31;355220;3552205;35
"Salvador";"Decreto Nº 32317 de 31 de março de 2020";"Dispõe sobre novas medidas de prevenção e controle para enfrentamento do COVID-19 no âmbito do município de Salvador.";"http://leismunicipa.is/uwxtr";"BA";0;0;1;0;0;0;0;2020-03-31;292740;2927408;29
"Patos de Minas";"Decreto Nº 4801 de 31 de março de 2020";"Dispõe sobre medidas complementares de proteção à coletividade a serem adotadas para o enfrentamento da emergência de saúde pública decorrente do Coronavírus (COVID-19) no municípi...";"http://leismunicipa.is/uxwpr";"MG";0;0;1;0;0;0;0;2020-03-31;314800;3148004;31
"Alto Alegre";"Decreto Nº 3151 de 31 de março de 2020";"Declara estado de calamidade pública e dispõe sobre medidas para o enfrentamento da emergência de saúde pública de importância internacional decorrente do surto epidêmico de corona...";"http://leismunicipa.is/dcbax";"RS";0;0;1;0;0;0;0;2020-03-31;140005;1400050;14
"Niterói";"Decreto Nº 13530 de 31 de março de 2020";"Suspende os efeitos do Decreto Municipal nº 11356/2013, tendo em vista o estado de emergência em saúde pública decorrente da pandemia de Coronavírus (COVID-19).";"http://leismunicipa.is/uowmx";"RJ";0;0;1;0;0;0;0;2020-03-31;330330;3303302;33
"Itapevi";"Decreto Nº 5539 de 31 de março de 2020";"DISPÕE SOBRE O ATENDIMENTO DE NECESSIDADE INADIÁVEL DE ALUNOS DA REDE PÚBLICA MUNICIPAL DE ENSINO, NO CONTEXTO DA PANDEMIA COVID-19 (NOVO CORONAVÍRUS), E DÁ PROVIDÊNCIAS CORRELATAS...";"http://leismunicipa.is/wrucx";"SP";0;0;1;0;0;0;0;2020-03-31;352250;3522505;35
"São Bernardo do Campo";"Ato da Mesa Nº 1037 de 31 de março de 2020";"Dispõe sobre os procedimentos e regras para fins de prevenção à infecção e à propagação do COVID-19 no âmbito dos Gabinetes dos Vereadores da Câmara Municipal de São Bernardo do Ca...";"http://leismunicipa.is/xqswv";"SP";0;0;0;0;0;0;0;2020-03-31;354870;3548708;35
"Niterói";"Lei Ordinária Nº 3480 de 31 de março de 2020";"Dispõe sobre a criação de renda básica temporária para cidadãos do município de Niterói inscritos no CadÚnico,";"http://leismunicipa.is/vdwxa";"RJ";1;0;0;0;0;0;0;2020-03-31;330330;3303302;33
"Barueri";"Decreto Nº 9118 de 31 de março de 2020";"PRORROGA A MEDIDA DE QUARENTENA NO ÂMBITO DO MUNICÍPIO DE BARUERI E ESTABELECE OUTRAS ATIVIDADES ESSENCIAIS COMO MEDIDA PARA ENFRENTAMENTO DA EMERGÊNCIA DE SAÚDE PÚBLICA DE IMPORTÂ...";"http://leismunicipa.is/diney";"SP";0;0;1;0;0;0;0;2020-03-31;350570;3505708;35
"Cabo de Santo Agostinho";"Decreto Nº 1881 de 31 de março de 2020";"Estabelece medidas temporárias no âmbito do território deste Município do Cabo de Santo Agostinho de prevenção ao contágio pelo Coronavírus (COVID-19), e dá outras providências.";"http://leismunicipa.is/mdgey";"PE";0;0;1;0;0;0;0;2020-03-31;260290;2602902;26
"Porto Alegre";"Decreto Nº 20534 de 31 de março de 2020";"Decreta o estado de calamidade pública e consolida as medidas para enfrentamento da emergência de saúde pública de importância internacional decorrente do novo Coronavírus (COVID-1...";"http://leismunicipa.is/cwvgx";"RS";0;0;1;0;0;0;0;2020-03-31;431490;4314902;43
"Manaus";"Lei Ordinária Nº 2595 de 31 de março de 2020";"INSTITUI o Programa Nossa Merenda, no âmbito do município de Manaus, como medida emergencial de enfrentamento à pandemia da COVID-19, e dá outras providências.";"http://leismunicipa.is/qnwvx";"AM";1;0;0;0;0;0;0;2020-03-31;130260;1302603;13
"Recife";"Decreto Nº 33579 de 31 de março de 2020";"REGULAMENTA A LEI Nº 18.701, DE 30 DE MARÇO DE 2020, QUE PRORROGA O PRAZO PARA ADESÃO AO PROGRAMA DE PARCELAMENTO INCENTIVADO (PPI) PREVISTO NA LEI N. 18.650, DE 30 DE OUTUBRO DE 2...";"http://leismunicipa.is/swurx";"PE";0;0;1;0;0;0;0;2020-03-31;261160;2611606;26
"Manaus";"Decreto Nº 4793 de 31 de março de 2020";"DISPÕE sobre medidas de contingenciamento, para enfrentamento da situação emergencial em saúde pública, decorrente da pandemia do novo coronavírus (COVID-19), no âmbito da Administ...";"http://leismunicipa.is/vxwmq";"AM";0;0;1;0;0;0;0;2020-03-31;130260;1302603;13
"Porto Alegre";"Decreto Nº 20532 de 30 de março de 2020";"Determina aos Hospitais e aos Laboratórios, públicos e privados, o encaminhamento de informações para a Secretaria Municipal de Saúde de Porto Alegre (SMS), com objetivo de colabor...";"http://leismunicipa.is/awxuo";"RS";0;0;1;0;0;0;0;2020-03-30;431490;4314902;43
"Osasco";"Decreto Nº 12415 de 30 de março de 2020";"ESTABELECE MEDIDAS DE POSTERGAÇÃO DO VENCIMENTO DO PAGAMENTO DE TRIBUTOS MUNICIPAIS, SEM INCIDÊNCIA DE MULTA E JUROS, EM DECORRÊNCIA DA PANDEMIA RELACIONADA AO CORONAVÍRUS (COVID-1...";"http://leismunicipa.is/awuox";"SP";0;0;1;0;0;0;0;2020-03-30;353440;3534401;35
"Recife";"Lei Ordinária Nº 18701 de 30 de março de 2020";"PRORROGA O PRAZO PARA ADESÃO PROGRAMA DE PARCELAMENTO INCENTIVADO (PPI) PREVISTO NA LEI N. 18.650, DE 30 DE OUTUBRO DE 2019, EM RAZÃO DE ESTADO DE EMERGÊNCIA DECORRENTE DA PANDEMIA...";"http://leismunicipa.is/uiwxo";"PE";1;0;0;0;0;0;0;2020-03-30;261160;2611606;26
